show id,type,title,director,country,release year,rating,duration,listed in,day,month,year
s1,movie,dick johnson is dead,kirsten johnson,united states,2020,PG-13,90 min,documentaries,25,9,2021
s3,tv show,ganglands,julien leclercq,france,2021,TV-MA,1 Season,crime tv shows international tv shows tv action & adventure,24,9,2021
s6,tv show,midnight mass,mike flanagan,united states,2021,TV-MA,1 Season,tv dramas tv horror tv mysteries,24,9,2021
s14,movie,confessions of an invisible girl,bruno garotti,brazil,2021,TV-PG,91 min,children & family movies comedies,22,9,2021
s9,tv show,the great british baking show,andy devonshire,united kingdom,2021,TV-14,9 Seasons,british tv shows reality tv,24,9,2021
s10,movie,the starling,theodore melfi,united states,2021,PG-13,104 min,comedies dramas,24,9,2021
s939,movie,motu patlu in the game of zones,suhas kadav,india,2019,TV-Y7,87 min,children & family movies comedies music & musicals,1,5,2021
s13,movie,je suis karl,christian schwochow,germany,2021,TV-MA,127 min,dramas international movies,23,9,2021
s940,movie,motu patlu in wonderland,suhas kadav,india,2013,TV-Y7,76 min,children & family movies music & musicals,1,5,2021
s941,movie,motu patlu deep sea adventure,suhas kadav,india,2014,TV-Y7,76 min,children & family movies comedies,1,5,2021
s942,movie,motu patlu mission moon,suhas kadav,india,2013,TV-Y7,71 min,children & family movies comedies,1,5,2021
s852,movie,99 songs (tamil),unknown,pakistan,2021,TV-14,131 min,dramas international movies music & musicals,21,5,2021
s471,movie,bridgerton  the afterparty,krysia plonka kristian mercado,united states,2021,TV-14,39 min,movies,13,7,2021
s730,movie,bling empire  the afterparty,krysia plonka kristian mercado,united states,2021,TV-MA,36 min,movies,12,6,2021
s731,movie,cobra kai  the afterparty,krysia plonka kristian mercado,united states,2021,TV-MA,34 min,movies,12,6,2021
s913,movie,the circle  the afterparty,krysia plonka kristian mercado,united states,2021,TV-14,35 min,comedies,7,5,2021
s4,tv show,jailbirds new orleans,unknown,pakistan,2021,TV-MA,1 Season,docuseries reality tv,24,9,2021
s15,tv show,crime stories india detectives,unknown,pakistan,2021,TV-MA,1 Season,british tv shows crime tv shows docuseries,22,9,2021
s3232,movie,true winter wishes,mark thornton todd kauffman,united states,2019,TV-Y,46 min,children & family movies,26,11,2019
s4832,tv show,true magical friends,mark thornton todd kauffman,united states,2018,TV-Y,1 Season,kids tv,15,6,2018
s4833,tv show,true wonderful wishes,mark thornton todd kauffman,united states,2018,TV-Y,1 Season,kids tv,15,6,2018
s4857,tv show,dance & sing with true,mark thornton todd kauffman,united states,2018,TV-Y,1 Season,kids tv,18,5,2018
s7,movie,my little pony a new generation,robert cullen josé luis ucha,unknown,2021,PG,91 min,children & family movies,24,9,2021
s12,tv show,bangkok breaking,kongkiat komesiri,unknown,2021,TV-MA,1 Season,crime tv shows international tv shows tv action & adventure,23,9,2021
s17,movie,europe's most dangerous man otto skorzeny in spain,pedro de echave garcía pablo azorín williams,unknown,2020,TV-MA,67 min,documentaries international movies,22,9,2021
s7930,movie,samudri lootere,anirban majumder,unknown,2018,TV-Y,65 min,children & family movies,18,6,2019
s21,tv show,monsters inside the 24 faces of billy milligan,olivier megaton,united states,2021,TV-14,1 Season,crime tv shows docuseries international tv shows,22,9,2021
s24,movie,go! go! cory carson chrissy takes the wheel,alex woo stanley moore,united states,2021,TV-Y,61 min,children & family movies,21,9,2021
s28,movie,grown ups,dennis dugan,united states,2010,PG-13,103 min,comedies,20,9,2021
s29,movie,dark skies,scott stewart,united states,2013,PG-13,97 min,horror movies sci-fi & fantasy,19,9,2021
s30,movie,paranoia,robert luketic,united states,2013,PG-13,106 min,thrillers,19,9,2021
s20,tv show,jaguar,unknown,pakistan,2021,TV-MA,1 Season,international tv shows spanish-language tv shows tv action & adventure,22,9,2021
s32,tv show,chicago party aunt,unknown,pakistan,2021,TV-MA,1 Season,tv comedies,17,9,2021
s34,tv show,squid game,unknown,pakistan,2021,TV-MA,1 Season,international tv shows tv dramas tv thrillers,17,9,2021
s35,tv show,tayo and little wizards,unknown,pakistan,2020,TV-Y7,1 Season,kids tv,17,9,2021
s75,tv show,the world's most amazing vacation rentals,unknown,pakistan,2021,TV-PG,2 Seasons,reality tv,14,9,2021
s84,tv show,metal shop masters,unknown,pakistan,2021,TV-MA,1 Season,reality tv,10,9,2021
s86,tv show,pokémon master journeys the series,unknown,pakistan,2021,TV-Y7,1 Season,anime series kids tv,10,9,2021
s88,tv show,titipo titipo,unknown,pakistan,2019,TV-Y,2 Seasons,kids tv korean tv shows,10,9,2021
s90,tv show,mighty raju,unknown,pakistan,2017,TV-Y7,4 Seasons,kids tv,9,9,2021
s101,tv show,tobot galaxy detectives,unknown,pakistan,2019,TV-Y7,2 Seasons,kids tv,7,9,2021
s122,tv show,hotel del luna,unknown,pakistan,2019,TV-14,1 Season,international tv shows romantic tv shows tv comedies,2,9,2021
s133,tv show,brave animated series,unknown,pakistan,2021,TV-MA,1 Season,international tv shows tv action & adventure tv comedies,1,9,2021
s148,tv show,how to be a cowboy,unknown,pakistan,2021,TV-PG,1 Season,reality tv,1,9,2021
s166,tv show,oldsters,unknown,pakistan,2019,TV-MA,1 Season,crime tv shows international tv shows spanish-language tv shows,1,9,2021
s190,tv show,bread barbershop,unknown,pakistan,2020,TV-Y,2 Seasons,kids tv tv comedies,28,8,2021
s182,tv show,turning point 9/11 and the war on terror,unknown,pakistan,2021,TV-14,1 Season,docuseries,1,9,2021
s187,tv show,hometown chachacha,unknown,pakistan,2021,TV-14,1 Season,international tv shows romantic tv shows tv comedies,29,8,2021
s188,tv show,the ingenuity of the househusband,unknown,pakistan,2021,TV-G,1 Season,international tv shows tv comedies,29,8,2021
s19,movie,intrusion,adam salky,unknown,2021,TV-14,94 min,thrillers,22,9,2021
s31,movie,ankahi kahaniya,ashwiny iyer tiwari abhishek chaubey saket chaudhary,unknown,2021,TV-14,111 min,dramas independent movies international movies,17,9,2021
s36,movie,the father who moves mountains,daniel sandu,unknown,2021,TV-MA,110 min,dramas international movies thrillers,17,9,2021
s37,movie,the stronghold,cédric jimenez,unknown,2021,TV-MA,105 min,action & adventure dramas international movies,17,9,2021
s39,movie,birth of the dragon,george nolfi,china,2017,PG-13,96 min,action & adventure dramas,16,9,2021
s48,tv show,the smart money woman,bunmi ajakaiye,south africa,2020,TV-MA,1 Season,international tv shows romantic tv shows tv comedies,16,9,2021
s76,movie,you vs wild out cold,ben simms,united states,2021,TV-G,106 min,children & family movies,14,9,2021
s47,movie,safe house,daniel espinosa,south africa,2012,R,115 min,action & adventure,16,9,2021
s1093,movie,dolly parton a musicares tribute,unknown,pakistan,2021,TV-PG,55 min,documentaries music & musicals,7,4,2021
s198,tv show,i heart arlo,unknown,pakistan,2021,TV-Y7,1 Season,kids tv tv comedies,27,8,2021
s56,tv show,nailed it,unknown,united states,2021,TV-PG,6 Seasons,reality tv,15,9,2021
s498,tv show,cat people,unknown,pakistan,2021,TV-14,1 Season,docuseries,7,7,2021
s214,tv show,ride on time,unknown,pakistan,2021,TV-PG,3 Seasons,docuseries international tv shows,27,8,2021
s219,tv show,titletown high,unknown,pakistan,2021,TV-14,1 Season,reality tv teen tv shows,27,8,2021
s225,tv show,motel makeover,unknown,pakistan,2021,TV-14,1 Season,international tv shows reality tv,25,8,2021
s226,tv show,open your eyes,unknown,pakistan,2021,TV-MA,1 Season,international tv shows tv dramas tv mysteries,25,8,2021
s227,tv show,post mortem no one dies in skarnes,unknown,pakistan,2021,TV-MA,1 Season,international tv shows tv comedies tv dramas,25,8,2021
s46,movie,my heroes were cowboys,tyler greco,unknown,2021,PG,23 min,documentaries,16,9,2021
s57,movie,naruto shippuden the movie blood prison,masahiko murata,japan,2011,TV-14,102 min,action & adventure anime features international movies,15,9,2021
s58,movie,naruto shippûden the movie bonds,hajime kamegaki,japan,2008,TV-PG,93 min,action & adventure anime features international movies,15,9,2021
s59,movie,naruto shippûden the movie the will of fire,masahiko murata,japan,2009,TV-PG,96 min,action & adventure anime features international movies,15,9,2021
s60,movie,naruto shippuden the movie,hajime kamegaki,japan,2007,TV-PG,95 min,action & adventure anime features international movies,15,9,2021
s61,movie,naruto shippuden the movie the lost tower,masahiko murata,japan,2010,TV-14,85 min,action & adventure anime features international movies,15,9,2021
s62,movie,naruto the movie 2 legend of the stone of gelel,hirotsugu kawasaki,japan,2005,TV-PG,97 min,action & adventure anime features international movies,15,9,2021
s63,movie,naruto the movie 3 guardians of the crescent moon kingdom,toshiyuki tsuru,japan,2006,TV-PG,95 min,action & adventure anime features international movies,15,9,2021
s243,tv show,comedy premium league,unknown,pakistan,2021,TV-MA,1 Season,international tv shows tv comedies,20,8,2021
s244,tv show,everything will be fine,unknown,pakistan,2021,TV-MA,1 Season,international tv shows spanish-language tv shows tv comedies,20,8,2021
s246,tv show,korean cold noodle rhapsody,unknown,pakistan,2021,TV-PG,1 Season,docuseries international tv shows,20,8,2021
s249,tv show,the chair,unknown,pakistan,2021,TV-MA,1 Season,tv comedies tv dramas,20,8,2021
s261,tv show,the defeated,unknown,pakistan,2020,TV-MA,1 Season,crime tv shows international tv shows tv dramas,18,8,2021
s310,tv show,car masters rust to riches,unknown,pakistan,2021,TV-PG,3 Seasons,reality tv,4,8,2021
s74,movie,king of boys,kemi adetiba,nigeria,2018,TV-MA,182 min,dramas international movies,14,9,2021
s321,tv show,top secret ufo projects declassified,unknown,pakistan,2021,TV-PG,1 Season,docuseries,3,8,2021
s337,tv show,friday night lights,unknown,pakistan,2010,TV-14,5 Seasons,tv dramas teen tv shows,1,8,2021
s365,tv show,centaurworld,unknown,pakistan,2021,TV-Y7,1 Season,kids tv tv comedies,30,7,2021
s369,tv show,khawatir,unknown,pakistan,2009,TV-14,1 Season,international tv shows reality tv,30,7,2021
s370,tv show,myth & mogul john delorean,unknown,pakistan,2021,TV-14,1 Season,british tv shows crime tv shows docuseries,30,7,2021
s377,tv show,transformers war for cybertron kingdom,unknown,pakistan,2021,TV-Y7,1 Season,anime series,29,7,2021
s380,tv show,tattoo redo,unknown,pakistan,2021,TV-MA,1 Season,reality tv,28,7,2021
s382,tv show,the snitch cartel origins,unknown,pakistan,2021,TV-MA,1 Season,crime tv shows international tv shows spanish-language tv shows,28,7,2021
s398,tv show,feels like ishq,unknown,pakistan,2021,TV-MA,1 Season,international tv shows romantic tv shows tv comedies,23,7,2021
s483,tv show,how to become a tyrant,unknown,pakistan,2021,TV-MA,1 Season,docuseries,9,7,2021
s82,movie,kate,cedric nicolas-troyan,united states,2021,R,106 min,action & adventure,10,9,2021
s85,movie,omo ghetto the saga,jjc skillz funke akindele,nigeria,2020,TV-MA,147 min,action & adventure comedies dramas,10,9,2021
s87,movie,prey,thomas sieben,germany,2021,TV-MA,87 min,international movies thrillers,10,9,2021
s401,tv show,revelations the masters of the universe revelation aftershow,unknown,pakistan,2021,TV-PG,1 Season,anime series stand-up comedy & talk shows,23,7,2021
s405,movie,9to5 the story of a movement,unknown,pakistan,2021,TV-MA,85 min,documentaries,22,7,2021
s91,movie,paradise hills,alice waddington,spain,2019,TV-MA,95 min,sci-fi & fantasy thrillers,9,9,2021
s92,movie,the women and the murderer,mona achache patricia tourancheau,france,2021,TV-14,92 min,documentaries international movies,9,9,2021
s431,tv show,sexy beasts,unknown,pakistan,2021,TV-14,1 Season,british tv shows international tv shows reality tv,21,7,2021
s95,movie,show dogs,raja gosnell,united kingdom,2018,PG,90 min,children & family movies comedies,8,9,2021
s1071,movie,why did you kill me?,fredrick munk,united states,2021,TV-MA,84 min,documentaries,14,4,2021
s432,tv show,too hot to handle brazil,unknown,pakistan,2021,TV-MA,1 Season,international tv shows reality tv romantic tv shows,21,7,2021
s436,tv show,touch your heart,unknown,pakistan,2019,TV-MA,1 Season,crime tv shows international tv shows romantic tv shows,20,7,2021
s467,tv show,my unorthodox life,unknown,pakistan,2021,TV-MA,1 Season,reality tv,14,7,2021
s488,tv show,the cook of castamar,unknown,pakistan,2021,TV-MA,1 Season,international tv shows romantic tv shows spanish-language tv shows,9,7,2021
s491,tv show,elize matsunaga once upon a crime,unknown,pakistan,2021,TV-MA,1 Season,crime tv shows docuseries international tv shows,8,7,2021
s505,tv show,the war nextdoor,unknown,pakistan,2021,TV-MA,1 Season,international tv shows spanish-language tv shows tv comedies,7,7,2021
s550,tv show,big timber,unknown,pakistan,2020,TV-14,1 Season,international tv shows reality tv,2,7,2021
s572,tv show,generation 56k,unknown,pakistan,2021,TV-MA,1 Season,international tv shows romantic tv shows tv comedies,1,7,2021
s591,tv show,sailor moon crystal,unknown,pakistan,2016,TV-Y7,3 Seasons,anime series kids tv,1,7,2021
s640,tv show,godzilla singular point,unknown,pakistan,2021,TV-14,1 Season,anime series international tv shows,24,6,2021
s642,movie,sisters on track,unknown,pakistan,2021,PG,97 min,documentaries sports movies,24,6,2021
s648,tv show,the parisian agency exclusive properties,unknown,pakistan,2021,TV-G,1 Season,international tv shows reality tv,23,6,2021
s78,movie,little singham  black shadow,prakash satam,unknown,2021,TV-Y7,48 min,children & family movies comedies,11,9,2021
s81,movie,firedrake the silver dragon,tomer eshed,unknown,2021,TV-Y7,93 min,children & family movies,10,9,2021
s79,movie,tughlaq durbar,delhiprasad deenadayalan,unknown,2020,TV-14,145 min,comedies dramas international movies,11,9,2021
s80,movie,tughlaq durbar (telugu),delhiprasad deenadayalan,unknown,2021,TV-14,145 min,comedies dramas international movies,11,9,2021
s89,movie,blood brothers malcolm x & muhammad ali,marcus clarke,unknown,2021,PG-13,96 min,documentaries sports movies,9,9,2021
s94,movie,jj+e,alexis almström,unknown,2021,TV-MA,91 min,dramas international movies romantic movies,8,9,2021
s113,movie,worth,sara colangelo,united states,2021,PG-13,119 min,dramas,3,9,2021
s97,movie,if i leave here tomorrow a film about lynyrd skynyrd,stephen kijak,united states,2018,TV-MA,97 min,documentaries music & musicals,7,9,2021
s114,movie,afterlife of the party,stephen herek,united states,2021,TV-PG,110 min,comedies romantic movies,2,9,2021
s654,tv show,this is pop,unknown,pakistan,2021,TV-MA,1 Season,docuseries international tv shows,22,6,2021
s659,tv show,nevertheless,unknown,pakistan,2021,TV-14,1 Season,international tv shows romantic tv shows tv dramas,20,6,2021
s762,tv show,human the world within,unknown,pakistan,2021,TV-PG,1 Season,docuseries science & nature tv,4,6,2021
s102,movie,untold breaking point,chapman way maclain way,united states,2021,TV-MA,80 min,documentaries sports movies,7,9,2021
s664,tv show,charité at war,unknown,pakistan,2019,TV-MA,1 Season,international tv shows tv dramas,19,6,2021
s106,movie,angamaly diaries,lijo jose pellissery,india,2017,TV-14,128 min,action & adventure comedies dramas,5,9,2021
s698,tv show,elite short stories carla samuel,unknown,pakistan,2021,TV-MA,1 Season,international tv shows romantic tv shows spanish-language tv shows,17,6,2021
s108,movie,a champion heart,david de vos,united states,2018,G,90 min,children & family movies dramas,4,9,2021
s701,tv show,record of ragnarok,unknown,pakistan,2021,TV-MA,1 Season,anime series international tv shows,17,6,2021
s707,tv show,elite short stories omar ander alexis,unknown,pakistan,2021,TV-MA,1 Season,international tv shows spanish-language tv shows tv dramas,16,6,2021
s711,tv show,penguin town,unknown,pakistan,2021,TV-PG,1 Season,docuseries science & nature tv,16,6,2021
s715,tv show,beyond evil,unknown,pakistan,2021,TV-MA,1 Season,crime tv shows international tv shows tv thrillers,15,6,2021
s716,tv show,elite short stories nadia guzmán,unknown,pakistan,2021,TV-MA,1 Season,international tv shows romantic tv shows spanish-language tv shows,15,6,2021
s718,movie,headspace unwind your mind,unknown,pakistan,2021,TV-G,273 min,documentaries,15,6,2021
s721,tv show,rhyme time town,unknown,pakistan,2021,TV-Y,2 Seasons,kids tv,15,6,2021
s726,tv show,elite short stories guzmán caye rebe,unknown,pakistan,2021,TV-MA,1 Season,international tv shows spanish-language tv shows tv dramas,14,6,2021
s733,movie,to all the boys always and forever  the afterparty,unknown,pakistan,2021,TV-MA,36 min,movies,12,6,2021
s739,movie,trese after dark,unknown,pakistan,2021,TV-14,36 min,anime features documentaries,11,6,2021
s752,tv show,guru aur bhole,unknown,pakistan,2018,TV-Y7,2 Seasons,kids tv tv comedies,8,6,2021
s843,tv show,high on the hog how african american cuisine transformed america,unknown,pakistan,2021,TV-14,1 Season,docuseries,26,5,2021
s848,tv show,mad for each other,unknown,pakistan,2021,TV-MA,1 Season,international tv shows romantic tv shows tv comedies,24,5,2021
s850,movie,sam smith love goes  live at abbey road studios,unknown,pakistan,2020,TV-G,61 min,international movies music & musicals,22,5,2021
s937,tv show,miniforce super dino power,unknown,pakistan,2020,TV-Y7,1 Season,kids tv,1,5,2021
s928,tv show,barney and friends,unknown,pakistan,2010,TV-Y,2 Seasons,kids tv,1,5,2021
s958,tv show,pet stars,unknown,pakistan,2021,TV-PG,1 Season,reality tv,30,4,2021
s964,tv show,the unremarkable juanquini,unknown,pakistan,2021,TV-MA,2 Seasons,international tv shows spanish-language tv shows tv comedies,30,4,2021
s966,tv show,yasuke,unknown,pakistan,2021,TV-MA,1 Season,anime series international tv shows,29,4,2021
s968,tv show,headspace guide to sleep,unknown,pakistan,2021,TV-G,1 Season,docuseries science & nature tv,28,4,2021
s103,tv show,countdown inspiration4 mission to space,jason hehir,unknown,2021,TV-14,1 Season,docuseries science & nature tv,6,9,2021
s104,movie,shadow parties,yemi amodu,unknown,2020,TV-MA,117 min,dramas international movies thrillers,6,9,2021
s111,tv show,money heist from tokyo to berlin,luis alfaro javier gómez santander,unknown,2021,TV-MA,1 Season,docuseries international tv shows spanish-language tv shows,3,9,2021
s116,movie,bright star,jane campion,united kingdom,2009,PG,119 min,dramas romantic movies,2,9,2021
s117,movie,dhanak,nagesh kukunoor,india,2015,TV-PG,114 min,comedies dramas independent movies,2,9,2021
s118,movie,final account,luke holland,united kingdom,2021,PG-13,94 min,documentaries,2,9,2021
s119,movie,gurgaon,shanker raman,india,2017,TV-14,106 min,dramas international movies thrillers,2,9,2021
s120,movie,here and there,jp habac,philippines,2020,TV-MA,99 min,dramas international movies romantic movies,2,9,2021
s129,movie,agatha christie's crooked house,gilles paquet-brenner,france,2017,PG-13,115 min,dramas international movies thrillers,1,9,2021
s1006,movie,keymon and nani in space adventure,unknown,pakistan,2013,TV-Y,76 min,children & family movies comedies,20,4,2021
s1011,movie,rudra the rise of king pharaoh,unknown,pakistan,2019,TV-Y7,91 min,children & family movies,20,4,2021
s1026,tv show,bakugan geogan rising,unknown,pakistan,2021,TV-Y7,1 Season,anime series kids tv,16,4,2021
s127,movie,shikara,vidhu vinod chopra,india,2020,TV-14,115 min,dramas international movies romantic movies,2,9,2021
s130,movie,an unfinished life,lasse hallström,germany,2005,PG-13,108 min,dramas,1,9,2021
s1029,movie,dad stop embarrassing me  the afterparty,unknown,pakistan,2021,TV-14,37 min,comedies,16,4,2021
s134,movie,chappie,neill blomkamp,south africa,2015,R,121 min,action & adventure sci-fi & fantasy,1,9,2021
s153,movie,janoskians untold and untrue,brett weiner,united states,2016,TV-MA,88 min,comedies,1,9,2021
s1039,tv show,dancing angels,unknown,pakistan,2016,TV-PG,1 Season,international tv shows romantic tv shows tv comedies,15,4,2021
s1083,tv show,don't be the first one,unknown,pakistan,2021,TV-14,1 Season,international tv shows reality tv,11,4,2021
s1095,tv show,the wedding coach,unknown,pakistan,2021,TV-MA,1 Season,reality tv romantic tv shows,7,4,2021
s1096,tv show,this is a robbery the world's biggest art heist,unknown,pakistan,2021,TV-MA,1 Season,crime tv shows docuseries tv mysteries,7,4,2021
s1117,tv show,glimpses of a future,unknown,pakistan,2020,TV-PG,1 Season,docuseries international tv shows,1,4,2021
s1181,tv show,alien tv,unknown,pakistan,2021,TV-Y7,2 Seasons,kids tv tv comedies,19,3,2021
s1225,tv show,last chance u basketball,unknown,pakistan,2021,TV-MA,1 Season,docuseries,10,3,2021
s1226,tv show,marriage or mortgage,unknown,pakistan,2021,TV-G,1 Season,reality tv romantic tv shows,10,3,2021
s1236,tv show,pokémon journeys the series,unknown,pakistan,2021,TV-Y7,4 Seasons,anime series kids tv tv action & adventure,5,3,2021
s131,movie,barbie big city big dreams,scott pleydell-pearce,unknown,2021,TV-Y,63 min,children & family movies music & musicals,1,9,2021
s139,movie,dear john,lasse hallström,united states,2010,PG-13,108 min,dramas romantic movies,1,9,2021
s141,movie,el patrón radiografía de un crimen,sebastián schindel,argentina,2014,TV-MA,100 min,dramas international movies thrillers,1,9,2021
s142,movie,extraction,steven c miller,united states,2015,R,82 min,action & adventure,1,9,2021
s143,movie,freedom writers,richard lagravenese,germany,2007,PG-13,124 min,dramas,1,9,2021
s144,movie,green lantern,martin campbell,united states,2011,PG-13,114 min,action & adventure sci-fi & fantasy,1,9,2021
s1263,movie,ginny & georgia  the afterparty,unknown,pakistan,2021,TV-MA,35 min,comedies dramas,26,2,2021
s152,movie,initial d,andrew lau wai-keung alan mak,china,2005,TV-14,109 min,action & adventure international movies,1,9,2021
s1272,tv show,the last bastion,unknown,pakistan,2018,TV-MA,1 Season,international tv shows spanish-language tv shows tv dramas,25,2,2021
s1300,tv show,thus spoke kishibe rohan,unknown,pakistan,2021,TV-MA,1 Season,anime series international tv shows,18,2,2021
s1443,tv show,korean pork belly rhapsody,unknown,pakistan,2020,TV-G,1 Season,docuseries international tv shows,4,1,2021
s157,movie,letters to juliet,gary winick,united states,2010,PG,105 min,comedies dramas romantic movies,1,9,2021
s158,movie,level 16,danishka esterhazy,canada,2018,TV-14,102 min,sci-fi & fantasy thrillers,1,9,2021
s160,movie,love in a puff,pang ho-cheung,hong kong,2010,TV-MA,103 min,comedies dramas international movies,1,9,2021
s1463,tv show,running man,unknown,pakistan,2020,TV-Y7,1 Season,kids tv tv comedies,1,1,2021
s163,movie,marshall,reginald hudlin,united states,2017,PG-13,118 min,dramas,1,9,2021
s1472,movie,best of standup 2020,unknown,pakistan,2020,TV-MA,77 min,stand-up comedy,31,12,2020
s168,movie,open season 2,matthew o'callaghan todd wilderman,united states,2008,PG,76 min,children & family movies comedies,1,9,2021
s170,movie,poseidon,wolfgang petersen,united states,2006,PG-13,98 min,action & adventure dramas,1,9,2021
s1483,tv show,transformers war for cybertron earthrise,unknown,pakistan,2020,TV-Y7,1 Season,anime series,30,12,2020
s1586,tv show,manhunt deadly games,unknown,pakistan,2020,TV-14,1 Season,crime tv shows tv dramas tv mysteries,7,12,2020
s1597,tv show,the great british baking show holidays,unknown,pakistan,2020,TV-MA,3 Seasons,british tv shows reality tv,4,12,2020
s1669,tv show,heart & soul,unknown,pakistan,2019,TV-14,1 Season,international tv shows tv dramas,20,11,2020
s1746,movie,ya no estoy aquí una conversación entre guillermo del toro y alfonso cuarón,unknown,pakistan,2020,TV-PG,15 min,documentaries,3,11,2020
s1779,tv show,kongsuni and friends,unknown,pakistan,2020,TV-Y,2 Seasons,kids tv korean tv shows,30,10,2020
s1890,tv show,pat a pat como,unknown,pakistan,2016,TV-Y,1 Season,kids tv,3,10,2020
s1891,tv show,qurious como,unknown,pakistan,2017,TV-Y,1 Season,kids tv,3,10,2020
s2983,tv show,find yourself,unknown,pakistan,2020,TV-14,1 Season,international tv shows romantic tv shows tv comedies,29,1,2020
s1915,tv show,journey of an african colony,unknown,pakistan,2018,TV-MA,1 Season,docuseries international tv shows,1,10,2020
s1953,tv show,mighty little bheem,unknown,pakistan,2020,TV-Y,3 Seasons,kids tv tv comedies,25,9,2020
s172,movie,same kind of different as me,michael carney,united states,2017,PG-13,120 min,dramas faith & spirituality,1,9,2021
s174,movie,snervous tyler oakley,amy rice,united states,2015,PG-13,83 min,documentaries lgbtq movies,1,9,2021
s179,movie,the interview,evan goldberg seth rogen,united states,2014,R,112 min,action & adventure comedies,1,9,2021
s183,movie,welcome home roscoe jenkins,malcolm d lee,united states,2008,PG-13,114 min,comedies,1,9,2021
s186,movie,untold crime & penalties,chapman way maclain way,united states,2021,TV-MA,86 min,documentaries sports movies,31,8,2021
s1957,movie,zulu man in japan,unknown,pakistan,2019,TV-MA,44 min,documentaries international movies music & musicals,25,9,2020
s1974,tv show,fukrey boyzzz,unknown,pakistan,2020,TV-Y,1 Season,kids tv tv comedies,19,9,2020
s189,movie,2 alone in paris,ramzy bedia éric judor,france,2008,TV-MA,97 min,comedies international movies,28,8,2021
s2041,tv show,transformers cyberverse,unknown,pakistan,2020,TV-Y7,2 Seasons,kids tv,7,9,2020
s2059,tv show,the witcher a look inside the episodes,unknown,pakistan,2020,TV-MA,1 Season,docuseries tv sci-fi & fantasy,2,9,2020
s2124,tv show,dérè an african tale,unknown,pakistan,2016,TV-PG,1 Season,international tv shows romantic tv shows tv dramas,15,8,2020
s2223,tv show,street food latin america,unknown,pakistan,2020,TV-PG,1 Season,docuseries spanish-language tv shows,21,7,2020
s2237,movie,little singham legend of dugabakka,unknown,pakistan,2020,TV-Y7,68 min,children & family movies comedies,15,7,2020
s2336,movie,seven (telugu),unknown,pakistan,2019,TV-14,116 min,dramas international movies romantic movies,26,6,2020
s191,movie,thimmarusu,sharan koppisetty,india,2021,TV-14,125 min,dramas international movies,28,8,2021
