show id,type,title,director,country,release year,rating,duration,listed in,day,month,year
s494,tv show,resident evil infinite darkness,unknown,united states,2021,TV-MA,1 Season,anime series tv horror tv thrillers,8,7,2021
s500,tv show,dogs,unknown,united states,2021,TV-PG,2 Seasons,docuseries,7,7,2021
s510,tv show,ask the storybots,unknown,united states,2019,TV-Y,3 Seasons,kids tv,6,7,2021
s511,tv show,between,unknown,canada,2016,TV-14,2 Seasons,international tv shows tv dramas tv mysteries,6,7,2021
s512,tv show,chelsea,unknown,united states,2017,TV-MA,2 Seasons,stand-up comedy & talk shows tv comedies,6,7,2021
s513,tv show,code lyoko,unknown,france,2007,TV-Y7,4 Seasons,kids tv,6,7,2021
s514,tv show,colony,unknown,united states,2018,TV-14,3 Seasons,tv action & adventure tv dramas tv sci-fi & fantasy,6,7,2021
s515,tv show,cuckoo,unknown,united kingdom,2019,TV-MA,5 Seasons,british tv shows international tv shows tv comedies,6,7,2021
s516,tv show,derry girls,unknown,united kingdom,2019,TV-MA,2 Seasons,british tv shows international tv shows tv comedies,6,7,2021
s534,tv show,shtisel,unknown,israel,2021,TV-14,3 Seasons,international tv shows tv dramas,6,7,2021
s517,tv show,girl from nowhere,unknown,thailand,2021,TV-MA,2 Seasons,international tv shows tv dramas tv mysteries,6,7,2021
s518,tv show,good morning call,unknown,japan,2017,TV-14,2 Seasons,international tv shows romantic tv shows tv comedies,6,7,2021
s520,tv show,i am a killer,unknown,united kingdom,2020,TV-MA,2 Seasons,british tv shows crime tv shows docuseries,6,7,2021
s484,movie,last summer,unknown,pakistan,2021,TV-MA,102 min,dramas international movies romantic movies,9,7,2021
s521,tv show,i think you should leave with tim robinson,unknown,united states,2021,TV-MA,2 Seasons,tv comedies,6,7,2021
s522,tv show,kim's convenience,unknown,canada,2021,TV-MA,5 Seasons,international tv shows tv comedies,6,7,2021
s523,tv show,larva,unknown,russia,2015,TV-Y7,3 Seasons,kids tv korean tv shows tv comedies,6,7,2021
s524,tv show,marcella,unknown,united kingdom,2019,TV-MA,3 Seasons,british tv shows crime tv shows international tv shows,6,7,2021
s525,tv show,midnight diner tokyo stories,unknown,japan,2019,TV-MA,2 Seasons,international tv shows tv dramas,6,7,2021
s526,tv show,my little pony friendship is magic,unknown,united states,2018,TV-Y,8 Seasons,kids tv,6,7,2021
s527,tv show,orange is the new black,unknown,united states,2019,TV-MA,7 Seasons,tv comedies tv dramas,6,7,2021
s528,tv show,puffin rock,unknown,ireland,2016,TV-Y,2 Seasons,kids tv,6,7,2021
s531,tv show,richie rich,unknown,united states,2015,TV-G,2 Seasons,kids tv tv comedies,6,7,2021
s533,tv show,scream,unknown,united states,2019,TV-MA,3 Seasons,crime tv shows tv horror tv mysteries,6,7,2021
s589,tv show,rainbow rangers,unknown,united states,2018,TV-Y,1 Season,kids tv,1,7,2021
s536,tv show,some assembly required,unknown,canada,2015,TV-Y,2 Seasons,kids tv tv comedies,6,7,2021
s537,tv show,tales by light,unknown,australia,2018,TV-14,3 Seasons,docuseries international tv shows science & nature tv,6,7,2021
s538,tv show,terrace house opening new doors,unknown,japan,2018,TV-14,6 Seasons,international tv shows reality tv,6,7,2021
s539,tv show,the a list,unknown,united kingdom,2021,TV-PG,2 Seasons,british tv shows international tv shows tv dramas,6,7,2021
s540,tv show,the new legends of monkey,unknown,australia,2020,TV-PG,2 Seasons,kids tv tv action & adventure tv sci-fi & fantasy,6,7,2021
s541,tv show,the worst witch,unknown,united kingdom,2020,TV-G,4 Seasons,british tv shows kids tv,6,7,2021
s544,tv show,undercover,unknown,belgium,2020,TV-MA,2 Seasons,crime tv shows international tv shows tv action & adventure,6,7,2021
s545,tv show,workin' moms,unknown,canada,2021,TV-MA,5 Seasons,international tv shows tv comedies,6,7,2021
s546,tv show,yoohoo to the rescue,unknown,south korea,2020,TV-Y,3 Seasons,kids tv korean tv shows,6,7,2021
s548,tv show,we the people,unknown,united states,2021,TV-Y7,1 Season,kids tv,4,7,2021
s549,tv show,grey's anatomy,unknown,united states,2020,TV-14,17 Seasons,romantic tv shows tv dramas,3,7,2021
s554,tv show,mortel,unknown,france,2019,TV-MA,2 Seasons,crime tv shows international tv shows tv dramas,2,7,2021
s566,tv show,bureau of magical things,unknown,australia,2020,TV-G,1 Season,international tv shows kids tv tv mysteries,1,7,2021
s618,tv show,young royals,unknown,sweden,2021,TV-MA,1 Season,international tv shows romantic tv shows tv dramas,1,7,2021
s621,tv show,droppin' cash los angeles,unknown,united states,2019,TV-MA,1 Season,reality tv,30,6,2021
s626,tv show,somos,unknown,mexico,2021,TV-MA,1 Season,crime tv shows international tv shows spanish-language tv shows,30,6,2021
s628,tv show,the daily life of the immortal king,unknown,china,2020,TV-14,1 Season,anime series international tv shows teen tv shows,30,6,2021
s629,tv show,starbeam,unknown,united states,2021,TV-Y,4 Seasons,kids tv,29,6,2021
s632,tv show,the seven deadly sins,unknown,japan,2021,TV-14,5 Seasons,anime series international tv shows,28,6,2021
s639,tv show,sex/life,unknown,united states,2021,TV-MA,1 Season,romantic tv shows tv dramas,25,6,2021
s547,tv show,you are my spring,unknown,pakistan,2021,TV-14,1 Season,international tv shows romantic tv shows tv dramas,6,7,2021
s643,tv show,the naked director,unknown,japan,2021,TV-MA,2 Seasons,international tv shows tv dramas,24,6,2021
s649,tv show,too hot to handle,unknown,united states,2021,TV-MA,2 Seasons,reality tv romantic tv shows,23,6,2021
s660,tv show,bangkok love stories innocence,unknown,thailand,2018,TV-14,1 Season,international tv shows romantic tv shows tv dramas,19,6,2021
s661,tv show,black lightning,unknown,united states,2021,TV-14,4 Seasons,tv action & adventure tv dramas tv sci-fi & fantasy,19,6,2021
s662,tv show,call my agent!,unknown,france,2018,TV-MA,4 Seasons,international tv shows tv comedies tv dramas,19,6,2021
s663,tv show,champions,unknown,united states,2018,TV-14,1 Season,tv comedies,19,6,2021
s666,tv show,deadwind,unknown,finland,2020,TV-MA,2 Seasons,crime tv shows international tv shows tv dramas,19,6,2021
s668,tv show,glee,unknown,united states,2015,TV-14,6 Seasons,tv comedies tv dramas teen tv shows,19,6,2021
s669,tv show,hap and leonard,unknown,united states,2018,TV-MA,3 Seasons,crime tv shows tv dramas,19,6,2021
s670,tv show,locked up,unknown,spain,2020,TV-MA,5 Seasons,crime tv shows international tv shows spanish-language tv shows,19,6,2021
s674,tv show,no time for shame,unknown,argentina,2019,TV-MA,1 Season,international tv shows reality tv spanish-language tv shows,19,6,2021
s641,tv show,jiva!,unknown,pakistan,2021,TV-MA,1 Season,international tv shows tv dramas,24,6,2021
s675,tv show,pose,unknown,united states,2019,TV-MA,2 Seasons,tv dramas,19,6,2021
s676,tv show,rea(l)ove,unknown,japan,2018,TV-MA,1 Season,international tv shows reality tv romantic tv shows,19,6,2021
s678,tv show,schitt's creek,unknown,canada,2020,TV-MA,6 Seasons,tv comedies,19,6,2021
s679,tv show,the assassination of gianni versace,unknown,united states,2018,TV-MA,1 Season,crime tv shows tv dramas tv thrillers,19,6,2021
s680,tv show,the judgement,unknown,thailand,2018,TV-MA,1 Season,crime tv shows international tv shows tv dramas,19,6,2021
s681,tv show,the last dance,unknown,united states,2020,TV-MA,1 Season,docuseries,19,6,2021
s683,tv show,why are you like this,unknown,australia,2021,TV-MA,1 Season,international tv shows tv comedies,19,6,2021
s685,tv show,elite,unknown,spain,2021,TV-MA,4 Seasons,crime tv shows international tv shows spanish-language tv shows,18,6,2021
s687,tv show,hospital playlist,unknown,south korea,2021,TV-14,2 Seasons,international tv shows korean tv shows tv comedies,18,6,2021
s697,tv show,black summer,unknown,canada,2021,TV-MA,2 Seasons,tv action & adventure tv dramas tv horror,17,6,2021
s700,tv show,katla,unknown,iceland,2021,TV-MA,1 Season,international tv shows tv dramas tv mysteries,17,6,2021
s704,tv show,the gift,unknown,turkey,2021,TV-MA,3 Seasons,international tv shows tv dramas tv mysteries,17,6,2021
s710,tv show,millennials,unknown,argentina,2020,TV-MA,3 Seasons,international tv shows romantic tv shows spanish-language tv shows,16,6,2021
s714,tv show,avengers climate conundrum,unknown,united states,2020,TV-Y7,1 Season,kids tv tv comedies,15,6,2021
s692,tv show,so not worth it,unknown,pakistan,2021,TV-14,1 Season,international tv shows tv comedies,18,6,2021
s732,tv show,love (ft marriage and divorce),unknown,south korea,2021,TV-14,2 Seasons,international tv shows tv dramas,12,6,2021
s734,tv show,lego friends the power of friendship,unknown,denmark,2016,TV-Y7,2 Seasons,kids tv,11,6,2021
s735,tv show,lupin,unknown,france,2021,TV-MA,2 Seasons,crime tv shows international tv shows tv action & adventure,11,6,2021
s745,tv show,locombianos,unknown,colombia,2021,TV-MA,1 Season,international tv shows spanish-language tv shows stand-up comedy & talk shows,10,6,2021
s749,tv show,fresh fried & crispy,unknown,united states,2021,TV-PG,1 Season,reality tv,9,6,2021
s750,tv show,la’s finest,unknown,united states,2021,TV-MA,2 Seasons,crime tv shows tv action & adventure tv comedies,9,6,2021
s754,tv show,newly rich newly poor,unknown,colombia,2007,TV-MA,1 Season,international tv shows romantic tv shows spanish-language tv shows,6,6,2021
s756,movie,kitty love an homage to cats,unknown,netherlands,2021,TV-G,61 min,children & family movies documentaries international movies,5,6,2021
s764,tv show,sweet tooth,unknown,united states,2021,TV-14,1 Season,tv action & adventure tv dramas tv sci-fi & fantasy,4,6,2021
s768,tv show,creator's file gold,unknown,japan,2021,TV-14,1 Season,international tv shows tv comedies,3,6,2021
s773,tv show,summertime,unknown,italy,2021,TV-MA,2 Seasons,international tv shows romantic tv shows tv dramas,3,6,2021
s779,tv show,attack on titan,unknown,japan,2013,TV-MA,1 Season,anime series international tv shows,2,6,2021
s781,tv show,ben & holly's little kingdom,unknown,united kingdom,2019,TV-Y,2 Seasons,kids tv,2,6,2021
s786,tv show,cocomelon,unknown,united states,2021,TV-Y,3 Seasons,kids tv,2,6,2021
s790,tv show,downton abbey,unknown,united kingdom,2015,TV-14,6 Seasons,british tv shows international tv shows tv dramas,2,6,2021
s796,tv show,happy endings,unknown,united states,2012,TV-14,3 Seasons,tv comedies,2,6,2021
s877,tv show,alma matters,unknown,india,2021,TV-MA,1 Season,docuseries international tv shows,14,5,2021
s821,tv show,the platform,unknown,united arab emirates,2021,TV-14,3 Seasons,international tv shows tv dramas tv mysteries,2,6,2021
s826,tv show,dirty john,unknown,united states,2020,TV-MA,2 Seasons,crime tv shows tv dramas tv mysteries,31,5,2021
s831,tv show,the kominsky method,unknown,united states,2021,TV-MA,3 Seasons,tv comedies tv dramas,28,5,2021
s834,tv show,black space,unknown,israel,2021,TV-MA,1 Season,crime tv shows international tv shows tv dramas,27,5,2021
s838,tv show,ragnarok,unknown,norway,2021,TV-MA,2 Seasons,international tv shows tv action & adventure tv dramas,27,5,2021
s844,tv show,jojo's bizarre adventure,unknown,japan,2016,TV-MA,3 Seasons,anime series international tv shows,26,5,2021
s849,tv show,master of none,unknown,united states,2021,TV-MA,3 Seasons,tv comedies tv dramas,23,5,2021
s806,tv show,racket boys,unknown,pakistan,2021,TV-14,1 Season,international tv shows tv comedies tv dramas,2,6,2021
s836,tv show,eden,unknown,pakistan,2021,TV-PG,1 Season,anime series international tv shows,27,5,2021
s856,tv show,jurassic world camp cretaceous,unknown,united states,2021,TV-Y7,3 Seasons,kids tv tv action & adventure tv sci-fi & fantasy,21,5,2021
s858,tv show,the neighbor,unknown,spain,2021,TV-MA,2 Seasons,international tv shows spanish-language tv shows tv comedies,21,5,2021
s863,tv show,special,unknown,united states,2021,TV-MA,2 Seasons,tv comedies,20,5,2021
s870,tv show,who killed sara?,unknown,mexico,2021,TV-MA,2 Seasons,crime tv shows international tv shows spanish-language tv shows,19,5,2021
s875,tv show,booba food puzzle,unknown,united kingdom,2021,TV-Y,1 Season,kids tv,15,5,2021
s881,tv show,haunted,unknown,united states,2021,TV-MA,3 Seasons,reality tv tv horror tv thrillers,14,5,2021
s884,tv show,love death & robots,unknown,united states,2021,TV-MA,2 Seasons,tv action & adventure tv horror tv sci-fi & fantasy,14,5,2021
s885,tv show,move to heaven,unknown,south korea,2021,TV-MA,1 Season,international tv shows tv dramas,14,5,2021
s891,tv show,castlevania,unknown,united states,2021,TV-MA,4 Seasons,anime series tv horror tv thrillers,13,5,2021
s897,tv show,the upshaws,unknown,united states,2021,TV-14,1 Season,tv comedies,12,5,2021
s903,tv show,mine,unknown,south korea,2021,TV-14,1 Season,international tv shows tv dramas,9,5,2021
s909,tv show,jupiter's legacy,unknown,united states,2021,TV-MA,1 Season,tv action & adventure tv sci-fi & fantasy,7,5,2021
s919,tv show,lava ka dhaava,unknown,india,2021,TV-PG,1 Season,reality tv,5,5,2021
s921,tv show,selena the series,unknown,mexico,2020,TV-PG,2 Seasons,tv dramas,4,5,2021
s922,tv show,startup,unknown,united states,2018,TV-MA,3 Seasons,crime tv shows tv dramas,4,5,2021
s889,movie,the upshaws  the afterparty,unknown,pakistan,2021,TV-14,32 min,comedies,14,5,2021
s924,tv show,trash truck,unknown,pakistan,2021,TV-Y,2 Seasons,kids tv,4,5,2021
s969,tv show,sexify,unknown,poland,2021,TV-MA,1 Season,international tv shows tv comedies tv dramas,28,4,2021
s973,tv show,fatma,unknown,turkey,2021,TV-MA,1 Season,international tv shows tv dramas tv thrillers,27,4,2021
s1366,tv show,zig & sharko,unknown,france,2019,TV-Y7,2 Seasons,kids tv tv comedies,1,2,2021
s976,movie,shadow and bone  the afterparty,unknown,united states,2021,TV-14,33 min,action & adventure comedies dramas,24,4,2021
s1015,tv show,pj masks,unknown,france,2019,TV-Y,3 Seasons,kids tv,19,4,2021
s994,tv show,shadow and bone,unknown,united states,2021,TV-14,1 Season,tv action & adventure tv dramas tv sci-fi & fantasy,23,4,2021
s1004,tv show,zero,unknown,italy,2021,TV-MA,1 Season,international tv shows tv comedies tv dramas,21,4,2021
s1005,tv show,izzy's koala world,unknown,australia,2021,TV-Y,2 Seasons,kids tv,20,4,2021
s1012,movie,free to play,unknown,united states,2014,TV-14,76 min,documentaries,19,4,2021
s1013,tv show,luis miguel  the series,unknown,mexico,2021,TV-MA,2 Seasons,international tv shows spanish-language tv shows tv dramas,19,4,2021
s1033,tv show,love naggers,unknown,south korea,2021,TV-14,1 Season,international tv shows stand-up comedy & talk shows,16,4,2021
s1041,tv show,durarara!!,unknown,japan,2016,TV-MA,1 Season,anime series crime tv shows international tv shows,15,4,2021
s1044,tv show,gilmore girls,unknown,united states,2006,TV-14,7 Seasons,romantic tv shows tv comedies tv dramas,15,4,2021
s1045,tv show,highrise invasion,unknown,japan,2021,TV-MA,1 Season,anime series international tv shows tv thrillers,15,4,2021
s1046,tv show,next in fashion,unknown,united states,2020,TV-14,1 Season,reality tv,15,4,2021
s1048,tv show,peasants rebellion,unknown,lebanon,2018,TV-14,1 Season,international tv shows tv dramas,15,4,2021
s1049,tv show,power players,unknown,united states,2020,TV-Y,3 Seasons,kids tv,15,4,2021
s1050,tv show,ricky zoom,unknown,china,2019,TV-Y,1 Season,british tv shows kids tv,15,4,2021
s1058,tv show,dad stop embarrassing me!,unknown,united states,2021,TV-14,1 Season,tv comedies,14,4,2021
s1059,tv show,fate the winx saga,unknown,italy,2021,TV-MA,1 Season,british tv shows international tv shows tv dramas,14,4,2021
s1060,tv show,house of cards,unknown,united states,2018,TV-MA,6 Seasons,tv dramas tv thrillers,14,4,2021
s1061,tv show,indian matchmaking,unknown,united states,2020,TV-14,1 Season,reality tv romantic tv shows,14,4,2021
s1062,tv show,jeffrey epstein filthy rich,unknown,united states,2020,TV-MA,1 Season,crime tv shows docuseries,14,4,2021
s1063,tv show,law school,unknown,south korea,2021,TV-14,1 Season,crime tv shows international tv shows tv dramas,14,4,2021
s1064,tv show,living with yourself,unknown,united states,2019,TV-MA,1 Season,tv comedies tv dramas,14,4,2021
s1065,tv show,signal,unknown,south korea,2016,TV-MA,1 Season,crime tv shows international tv shows korean tv shows,14,4,2021
s1066,tv show,slasher,unknown,canada,2019,TV-MA,3 Seasons,tv horror tv mysteries tv thrillers,14,4,2021
s1057,tv show,ajaibnya cinta,unknown,pakistan,2015,TV-PG,1 Season,international tv shows tv dramas,14,4,2021
s1069,tv show,unnatural selection,unknown,united states,2019,TV-MA,1 Season,docuseries science & nature tv,14,4,2021
s1080,tv show,the baker and the beauty,unknown,israel,2020,TV-PG,1 Season,romantic tv shows tv comedies tv dramas,13,4,2021
s1082,tv show,nicky ricky dicky & dawn,unknown,united states,2018,TV-G,4 Seasons,kids tv tv comedies,12,4,2021
s1085,tv show,heaven official's blessing,unknown,china,2020,TV-14,1 Season,anime series international tv shows romantic tv shows,9,4,2021
s1092,tv show,the way of the househusband,unknown,japan,2021,TV-MA,1 Season,anime series international tv shows,8,4,2021
s1094,tv show,the big day,unknown,india,2021,TV-14,2 Seasons,international tv shows reality tv romantic tv shows,7,4,2021
s1124,tv show,magical andes,unknown,uruguay,2021,TV-G,2 Seasons,docuseries international tv shows science & nature tv,1,4,2021
s1126,tv show,murder maps,unknown,united kingdom,2017,TV-MA,2 Seasons,british tv shows crime tv shows docuseries,1,4,2021
s1128,tv show,prank encounters,unknown,united states,2021,TV-MA,2 Seasons,reality tv tv comedies tv horror,1,4,2021
s1130,tv show,secrets of great british castles,unknown,united kingdom,2016,TV-PG,2 Seasons,british tv shows docuseries international tv shows,1,4,2021
s1144,tv show,worn stories,unknown,united states,2021,TV-MA,1 Season,docuseries reality tv,1,4,2021
s1149,tv show,robocar poli,unknown,south korea,2015,TV-Y,2 Seasons,kids tv korean tv shows,31,3,2021
s1150,tv show,yugioh!,unknown,japan,2005,TV-Y7,1 Season,anime series kids tv,31,3,2021
s1153,tv show,rainbow high,unknown,united states,2020,TV-Y,1 Season,kids tv,30,3,2021
s1158,movie,bad trip,unknown,united states,2021,TV-MA,87 min,comedies,26,3,2021
s1159,tv show,big time rush,unknown,united states,2013,TV-G,4 Seasons,kids tv,26,3,2021
s1162,movie,elizabeth and margaret love and loyalty,unknown,united kingdom,2020,TV-PG,87 min,documentaries,26,3,2021
s1164,tv show,magic for humans spain,unknown,spain,2021,TV-MA,1 Season,international tv shows reality tv spanish-language tv shows,26,3,2021
s1616,tv show,ink master,unknown,united states,2012,TV-14,2 Seasons,reality tv,1,12,2020
s1167,tv show,the irregulars,unknown,united kingdom,2021,TV-14,1 Season,british tv shows crime tv shows international tv shows,26,3,2021
s1169,tv show,dota dragon's blood,unknown,united states,2021,TV-MA,1 Season,anime series,25,3,2021
s1170,tv show,pui pui molcar,unknown,japan,2021,TV-Y7,1 Season,kids tv,25,3,2021
s1175,tv show,navillera,unknown,south korea,2021,TV-14,1 Season,international tv shows tv dramas,23,3,2021
s1180,tv show,mighty morphin power rangers,unknown,united states,2010,TV-Y7,4 Seasons,kids tv,20,3,2021
s1182,tv show,country comfort,unknown,united states,2021,TV-PG,1 Season,tv comedies,19,3,2021
s1183,tv show,formula 1 drive to survive,unknown,united kingdom,2021,TV-MA,3 Seasons,docuseries,19,3,2021
s1187,tv show,b the beginning,unknown,japan,2021,TV-MA,2 Seasons,anime series crime tv shows international tv shows,18,3,2021
s1201,tv show,waffles + mochi,unknown,united states,2021,TV-Y,1 Season,kids tv,16,3,2021
s1202,tv show,abla fahita drama queen,unknown,egypt,2021,TV-14,1 Season,crime tv shows international tv shows tv comedies,15,3,2021
s1206,tv show,the lost pirate kingdom,unknown,united states,2021,TV-MA,1 Season,docuseries science & nature tv tv action & adventure,15,3,2021
s1207,tv show,zero chill,unknown,united kingdom,2021,TV-G,1 Season,british tv shows kids tv tv dramas,15,3,2021
s1211,tv show,love alarm,unknown,south korea,2021,TV-MA,2 Seasons,international tv shows korean tv shows romantic tv shows,12,3,2021
s1405,tv show,henry danger,unknown,united states,2016,TV-G,3 Seasons,kids tv tv comedies,15,1,2021
s1214,tv show,paradise pd,unknown,united states,2021,TV-MA,3 Seasons,tv comedies,12,3,2021
s1218,tv show,the one,unknown,united kingdom,2021,TV-MA,1 Season,british tv shows crime tv shows international tv shows,12,3,2021
s1227,tv show,the houseboat,unknown,germany,2021,TV-14,1 Season,docuseries international tv shows,9,3,2021
s1228,tv show,bombay begums,unknown,india,2021,TV-MA,1 Season,international tv shows tv dramas,8,3,2021
s1230,tv show,my way,unknown,egypt,2015,TV-14,1 Season,international tv shows tv dramas,6,3,2021
s1232,tv show,city of ghosts,unknown,united states,2021,TV-Y7,1 Season,kids tv,5,3,2021
s1239,tv show,pacific rim the black,unknown,united states,2021,TV-14,1 Season,anime series,4,3,2021
s1246,tv show,word party,unknown,united states,2021,TV-Y,5 Seasons,kids tv,2,3,2021
s1307,tv show,good girls,unknown,united states,2020,TV-MA,3 Seasons,crime tv shows tv comedies tv dramas,16,2,2021
s1258,tv show,tiger & bunny,unknown,japan,2011,TV-14,1 Season,anime series international tv shows,28,2,2021
s1269,tv show,el final del paraíso,unknown,united states,2019,TV-MA,1 Season,crime tv shows international tv shows spanish-language tv shows,25,2,2021
s1271,tv show,sin senos sí hay paraíso,unknown,united states,2018,TV-MA,3 Seasons,international tv shows spanish-language tv shows tv dramas,25,2,2021
s1273,tv show,age of samurai battle for japan,unknown,united states,2021,TV-MA,1 Season,docuseries international tv shows,24,2,2021
s1275,tv show,canine intervention,unknown,united states,2021,TV-PG,1 Season,reality tv,24,2,2021
s1276,tv show,ginny & georgia,unknown,united states,2021,TV-14,1 Season,romantic tv shows tv comedies tv dramas,24,2,2021
s1278,tv show,two sentence horror stories,unknown,united states,2021,TV-14,2 Seasons,tv horror teen tv shows,24,2,2021
s1283,tv show,zindagi in short,unknown,india,2020,TV-MA,1 Season,international tv shows tv dramas,22,2,2021
s1286,tv show,vincenzo,unknown,south korea,2021,TV-14,1 Season,international tv shows tv comedies tv dramas,21,2,2021
s1693,tv show,america's next top model,unknown,united states,2013,TV-14,2 Seasons,reality tv,15,11,2020
s1288,movie,fate the winx saga  the afterparty,unknown,united kingdom,2021,TV-14,36 min,comedies dramas,20,2,2021
s1295,tv show,tribes of europa,unknown,germany,2021,TV-MA,1 Season,international tv shows tv action & adventure tv dramas,19,2,2021
s1297,tv show,hello me!,unknown,south korea,2021,TV-14,1 Season,international tv shows romantic tv shows tv comedies,18,2,2021
s1299,tv show,sisyphus,unknown,south korea,2021,TV-14,1 Season,international tv shows tv action & adventure tv dramas,18,2,2021
s1301,tv show,amend the fight for america,unknown,united states,2021,TV-MA,1 Season,docuseries,17,2,2021
s1302,tv show,behind her eyes,unknown,united kingdom,2021,TV-MA,1 Season,british tv shows international tv shows tv dramas,17,2,2021
s1303,tv show,meateater,unknown,united states,2021,TV-14,4 Seasons,docuseries reality tv science & nature tv,17,2,2021
s1311,tv show,the crew,unknown,united states,2021,TV-14,1 Season,tv comedies,15,2,2021
s1314,tv show,buried by the bernards,unknown,united states,2021,TV-14,1 Season,reality tv,12,2,2021
s1318,tv show,nadiya bakes,unknown,united kingdom,2021,TV-G,1 Season,british tv shows international tv shows reality tv,12,2,2021
s1321,tv show,capitani,unknown,luxembourg,2019,TV-MA,1 Season,crime tv shows international tv shows tv dramas,11,2,2021
s1322,tv show,el chema,unknown,mexico,2016,TV-MA,1 Season,crime tv shows spanish-language tv shows tv action & adventure,11,2,2021
s1333,tv show,icarly,unknown,united states,2008,TV-G,2 Seasons,kids tv tv comedies,8,2,2021
s1336,tv show,the sinner,unknown,united states,2020,TV-MA,3 Seasons,crime tv shows tv dramas tv mysteries,6,2,2021
s1339,tv show,hache,unknown,spain,2021,TV-MA,2 Seasons,crime tv shows international tv shows spanish-language tv shows,5,2,2021
s1340,tv show,invisible city,unknown,brazil,2021,TV-MA,1 Season,crime tv shows international tv shows tv dramas,5,2,2021
s1869,tv show,deaf u,unknown,united states,2020,TV-MA,1 Season,docuseries,9,10,2020
s1349,tv show,firefly lane,unknown,united states,2021,TV-MA,1 Season,romantic tv shows tv dramas,3,2,2021
s1350,tv show,pablo escobar el patrón del mal,unknown,colombia,2012,TV-MA,1 Season,crime tv shows international tv shows spanish-language tv shows,3,2,2021
s1351,tv show,power rangers ninja steel,unknown,united states,2018,TV-Y7,2 Seasons,kids tv,3,2,2021
s1353,tv show,tiffany haddish presents they ready,unknown,united states,2021,TV-MA,2 Seasons,stand-up comedy & talk shows tv comedies,2,2,2021
s1355,tv show,heartland,unknown,canada,2019,TV-14,13 Seasons,tv dramas,1,2,2021
s1356,tv show,love daily,unknown,united states,2018,TV-14,1 Season,romantic tv shows teen tv shows,1,2,2021
s1357,tv show,my dead ex,unknown,united states,2018,TV-14,1 Season,tv comedies teen tv shows,1,2,2021
s1362,tv show,the unsettling,unknown,united states,2019,TV-14,1 Season,tv horror teen tv shows,1,2,2021
s1363,tv show,total drama,unknown,canada,2015,TV-PG,7 Seasons,kids tv tv comedies,1,2,2021
s1364,tv show,zac and mia,unknown,united states,2019,TV-14,2 Seasons,romantic tv shows tv dramas teen tv shows,1,2,2021
s1372,tv show,we are the brooklyn saints,unknown,united states,2021,TV-14,1 Season,docuseries,29,1,2021
s1374,tv show,50m2,unknown,turkey,2021,TV-MA,1 Season,international tv shows tv dramas tv thrillers,27,1,2021
s1376,tv show,bonding,unknown,united states,2021,TV-MA,2 Seasons,tv comedies tv dramas,27,1,2021
s1378,tv show,outlander,unknown,united states,2018,TV-MA,4 Seasons,romantic tv shows tv action & adventure tv dramas,27,1,2021
s1381,tv show,go dog go,unknown,united states,2021,TV-Y,1 Season,kids tv,26,1,2021
s1384,tv show,blown away,unknown,canada,2021,TV-14,2 Seasons,international tv shows reality tv,22,1,2021
s1385,tv show,busted!,unknown,south korea,2021,TV-14,3 Seasons,crime tv shows international tv shows korean tv shows,22,1,2021
