show id,type,title,director,country,release year,rating,duration,listed in,day,month,year
s2727,movie,hasee toh phasee,vinil mathew,india,2014,TV-14,135 min,comedies dramas international movies,1,4,2020
s2729,movie,humpty sharma ki dulhania,shashank khaitan,india,2014,TV-14,131 min,comedies international movies romantic movies,1,4,2020
s2730,movie,kaal,soham shah,india,2005,TV-14,126 min,horror movies international movies thrillers,1,4,2020
s2731,movie,kabhi alvida naa kehna,karan johar,india,2006,TV-14,192 min,dramas international movies romantic movies,1,4,2020
s2734,movie,kapoor & sons,shakun batra,india,2016,TV-14,138 min,comedies dramas international movies,1,4,2020
s2736,movie,magnificent,vikas bahl,india,2015,TV-14,143 min,comedies international movies romantic movies,1,4,2020
s2738,movie,mighty raju rio calling,rajiv chilaka anirban majumder alka amarkant dubey,india,2014,TV-Y7,97 min,children & family movies sports movies,1,4,2020
s2742,movie,sethum aayiram pon,anand ravichandran,india,2020,TV-MA,103 min,dramas independent movies international movies,1,4,2020
s2745,movie,the little vampire,richard claus karsten kiilerich,netherlands,2017,TV-G,83 min,children & family movies,1,4,2020
s2746,movie,the runaways,floria sigismondi,united states,2010,R,107 min,dramas independent movies music & musicals,1,4,2020
s2748,movie,ungli,renzil d'silva,india,2014,TV-14,114 min,comedies dramas international movies,1,4,2020
s2750,movie,wildling,fritz böhm,united states,2018,R,93 min,horror movies independent movies sci-fi & fantasy,1,4,2020
s2751,movie,a truthful mother,ravishankar venkateswaran,india,2020,TV-Y7,85 min,children & family movies,31,3,2020
s5431,movie,marco luque tamo junto,caio cobra,brazil,2017,TV-MA,73 min,stand-up comedy,15,6,2017
s2753,tv show,bal ganesh,vijay s bhanushali,unknown,2019,TV-Y7,1 Season,kids tv,31,3,2020
s2755,movie,greater,david hunt,united states,2016,PG,131 min,children & family movies dramas sports movies,31,3,2020
s2756,movie,indian horse,stephen s campanelli,canada,2017,TV-MA,101 min,dramas independent movies sports movies,31,3,2020
s2757,movie,paharganj,rakesh ranjan kumar,india,2019,TV-MA,107 min,dramas independent movies international movies,31,3,2020
s2758,movie,pretty little stalker,sam irvin,united states,2018,TV-14,84 min,thrillers,31,3,2020
s2759,movie,through my father's eyes the ronda rousey story,gary stretch,canada,2019,R,104 min,documentaries sports movies,31,3,2020
s2761,movie,kannum kannum kollaiyadithaal,desingh periyasamy,india,2020,TV-14,160 min,comedies dramas international movies,29,3,2020
s2763,movie,rogue warfare,mike gunther,united states,2019,R,103 min,action & adventure,28,3,2020
s2764,movie,dragons rescue riders hunt for the golden dragon,tj sullivan greg rankin,united states,2020,TV-Y,46 min,children & family movies comedies,27,3,2020
s2767,movie,maska,neeraj udhwani,india,2020,TV-MA,112 min,comedies dramas international movies,27,3,2020
s2769,movie,the decline,patrice laliberté,canada,2020,TV-MA,83 min,action & adventure international movies,27,3,2020
s2770,movie,there's something in the water,ellen page ian daniel,canada,2019,TV-14,72 min,documentaries international movies,27,3,2020
s2771,movie,true wuzzle wegg day,todd kauffman mark thornton,canada,2020,TV-Y,24 min,children & family movies,27,3,2020
s2772,movie,uncorked,prentice penny,united states,2020,TV-MA,104 min,dramas independent movies,27,3,2020
s2774,movie,willy and the guardians of the lake tales from the lakeside winter adventure,zsolt pálfi,hungary,2019,TV-Y,72 min,children & family movies,27,3,2020
s2776,movie,happy old year,nawapol thamrongrattanarit,thailand,2019,TV-MA,113 min,dramas international movies romantic movies,26,3,2020
s2777,movie,making unorthodox,marlene melchior,germany,2020,TV-G,21 min,documentaries international movies,26,3,2020
s2779,movie,bethany hamilton unstoppable,aaron lieber,united states,2019,PG,100 min,children & family movies documentaries sports movies,25,3,2020
s2781,movie,curtiz,tamas yvan topolanszky,hungary,2018,TV-MA,99 min,dramas international movies,25,3,2020
s2782,movie,the occupant,àlex pastor david pastor,spain,2020,TV-MA,104 min,independent movies international movies thrillers,25,3,2020
s2783,movie,tom segura ball hog,rami hachache,united states,2020,TV-MA,70 min,stand-up comedy,24,3,2020
s2787,movie,a life of speed the juan manuel fangio story,francisco macri,argentina,2020,TV-14,93 min,documentaries international movies sports movies,20,3,2020
s2790,movie,el silencio es bienvenido,gabriela garcía rivas,mexico,2017,TV-14,95 min,dramas independent movies international movies,20,3,2020
s2811,movie,bypass road,naman nitin mukesh,india,2019,TV-14,135 min,international movies thrillers,15,3,2020
s2796,tv show,tiger king murder mayhem and madness,eric goode rebecca chaiklin,united states,2020,TV-MA,1 Season,crime tv shows docuseries,20,3,2020
s2797,movie,ultras,francesco lettieri,italy,2020,TV-MA,109 min,dramas international movies sports movies,20,3,2020
s2799,movie,3022,john suits,united states,2019,R,91 min,independent movies sci-fi & fantasy thrillers,19,3,2020
s2800,movie,altered carbon resleeved,takeru nakajima yoshiyuki okada,japan,2020,TV-MA,75 min,action & adventure anime features international movies,19,3,2020
s2801,movie,masameer  the movie,malik nejer,saudi arabia,2020,TV-14,100 min,comedies international movies,19,3,2020
s2802,movie,alli wish,susan walter,united states,2017,R,95 min,dramas romantic movies,18,3,2020
s2804,movie,lu over the wall,masaaki yuasa,japan,2017,PG,113 min,anime features music & musicals sci-fi & fantasy,18,3,2020
s2806,movie,xv beyond the tryline,pierre deschamps,united kingdom,2016,TV-14,91 min,documentaries sports movies,18,3,2020
s2807,movie,bert kreischer hey big boy,jeff tomsic,united states,2020,TV-MA,62 min,stand-up comedy,17,3,2020
s2810,movie,search party,scot armstrong,united states,2014,R,93 min,comedies,16,3,2020
s2814,tv show,ken burns presents college behind bars a film by lynn novick and produced by sarah botstein,lynn novick,united states,2019,TV-MA,1 Season,docuseries,15,3,2020
s2816,movie,jai mummy di,navjot gulati,india,2020,TV-MA,101 min,comedies international movies romantic movies,14,3,2020
s2812,movie,digs & discoveries all track's lead to rome,joey so,unknown,2019,TV-Y,23 min,children & family movies,15,3,2020
s2818,movie,baby mamas,stephanie zwane,south africa,2018,TV-14,98 min,comedies dramas international movies,13,3,2020
s2813,movie,digs & discoveries mines of mystery,joey so,unknown,2019,TV-Y,23 min,children & family movies,15,3,2020
s2820,movie,go karts,owen trevor,australia,2020,TV-PG,103 min,children & family movies dramas,13,3,2020
s2821,movie,justine,stephanie turner,united states,2019,TV-MA,106 min,dramas independent movies,13,3,2020
s2822,tv show,kingdom,kim seong-hun,south korea,2020,TV-MA,2 Seasons,international tv shows korean tv shows tv action & adventure,13,3,2020
s2823,movie,lost girls,liz garbus,united states,2020,R,95 min,dramas,13,3,2020
s2824,movie,miracle in cell no 7,mehmet ada öztekin,turkey,2019,TV-14,132 min,dramas international movies,13,3,2020
s2815,movie,steam team to the rescue,joey so,unknown,2019,TV-Y,23 min,children & family movies,15,3,2020
s2829,movie,carmen sandiego to steal or not to steal,jos humphrey,canada,2020,TV-Y7,82 min,children & family movies,10,3,2020
s2830,movie,marc maron end times fun,lynn shelton,united states,2020,TV-MA,71 min,stand-up comedy,10,3,2020
s2831,movie,sitara let girls dream,sharmeen obaid-chinoy,pakistan,2020,TV-PG,16 min,children & family movies dramas,8,3,2020
s2833,movie,all about love,adze ugah,south africa,2017,TV-MA,79 min,dramas international movies romantic movies,6,3,2020
s2834,movie,guilty,ruchi narain,india,2020,TV-MA,120 min,dramas international movies,6,3,2020
s2835,movie,i am jonas,christophe charrier,france,2019,TV-MA,82 min,dramas independent movies international movies,6,3,2020
s2836,movie,miles davis birth of the cool,stanley nelson,united states,2019,TV-MA,115 min,documentaries music & musicals,6,3,2020
s2837,movie,spenser confidential,peter berg,united states,2020,R,111 min,action & adventure comedies,6,3,2020
s2838,movie,twin murders the silence of the white city,daniel calparsoro,spain,2020,TV-MA,110 min,international movies thrillers,6,3,2020
s2841,movie,angu vaikuntapurathu (malayalam),trivikram srinivas,india,2020,TV-14,162 min,action & adventure comedies dramas,5,3,2020
s2840,movie,93 days,steve gukas,nigeria,2016,TV-PG,121 min,dramas international movies thrillers,5,3,2020
s2832,movie,alakada reloaded,toyin abraham,unknown,2017,TV-MA,104 min,comedies international movies,6,3,2020
s2843,movie,tootsies & the fake,kittiphak thonguam,thailand,2019,TV-MA,108 min,comedies international movies lgbtq movies,5,3,2020
s2844,movie,aurora,cristi puiu,romania,2010,TV-MA,186 min,dramas international movies,4,3,2020
s2845,movie,lil peep everybody’s everything,sebastian jones ramez silyan,united states,2019,TV-MA,116 min,documentaries music & musicals,4,3,2020
s2846,movie,the death of mr lazarescu,cristi puiu,romania,2005,R,154 min,dramas international movies,4,3,2020
s2847,tv show,velvet,carlos sedes,spain,2016,TV-14,4 Seasons,international tv shows romantic tv shows spanish-language tv shows,4,3,2020
s2848,movie,freaks,adam b stein zach lipovsky,united states,2018,R,105 min,independent movies sci-fi & fantasy thrillers,3,3,2020
s2849,movie,luccas neto in the end of christmas,lucas margutti,brazil,2019,TV-Y,71 min,children & family movies comedies music & musicals,3,3,2020
s2850,movie,taylor tomlinson quarterlife crisis,marcus raboy,united states,2020,TV-MA,61 min,stand-up comedy,3,3,2020
s2851,movie,the last bomb of the second world war,athiyan athirai,india,2019,TV-14,133 min,dramas independent movies international movies,3,3,2020
s2852,movie,uncovered,zuko nodada,south africa,2019,TV-MA,98 min,dramas international movies,3,3,2020
s2853,movie,we,madonna,united kingdom,2011,R,119 min,dramas romantic movies,3,3,2020
s2854,movie,fat ballerina  david a arnold,milton horowitz,united states,2020,TV-MA,61 min,stand-up comedy,2,3,2020
s2859,movie,calico critters everyone's big dream flying in the sky,momoko kamiya,unknown,2019,TV-Y,11 min,children & family movies,1,3,2020
s2857,movie,bhangra paa le,sneha taurani,india,2019,TV-14,130 min,comedies dramas international movies,1,3,2020
s2865,movie,velvet colección grand finale,gustavo ron,unknown,2020,TV-14,82 min,dramas international movies romantic movies,1,3,2020
s2860,movie,frank & lola,matthew ross,united states,2016,TV-MA,87 min,dramas thrillers,1,3,2020
s2861,movie,hugo,martin scorsese,united states,2011,PG,127 min,children & family movies dramas,1,3,2020
s2862,movie,ordinary world,lee kirk,united states,2016,TV-14,87 min,comedies dramas music & musicals,1,3,2020
s2863,movie,pop lock 'n roll,ziggy hofmeyr,south africa,2017,TV-14,88 min,dramas international movies romantic movies,1,3,2020
s2864,movie,there will be blood,paul thomas anderson,united states,2007,R,158 min,dramas independent movies,1,3,2020
s2866,movie,voulezvous rire avec moi ce soir?,yacine belhousse,france,2018,TV-MA,93 min,documentaries international movies,1,3,2020
s2867,movie,zz top that little ol' band from texas,sam dunn,united kingdom,2019,TV-MA,90 min,documentaries music & musicals,1,3,2020
s2868,movie,all the bright places,brett haley,united states,2020,TV-MA,109 min,dramas romantic movies,28,2,2020
s2944,movie,the ballad of lefty brown,jared moshé,united states,2017,R,112 min,dramas,7,2,2020
s2885,movie,the visit,oyefunke fayoyin,unknown,2015,TV-MA,138 min,dramas independent movies international movies,26,2,2020
s2874,movie,ala vaikunthapurramuloo,trivikram srinivas,india,2020,TV-14,162 min,action & adventure comedies dramas,27,2,2020
s2877,movie,pokémon mewtwo strikes back  evolution,kunihiko yuyama motonori sakakibara,japan,2019,TV-Y7,98 min,anime features children & family movies,27,2,2020
s2878,tv show,six windows in the desert,ali kalthami meshal aljaser faris godus mohamed al salman faisal al amer,saudi arabia,2020,TV-14,1 Season,tv shows,27,2,2020
s2879,movie,couple of days,tolu awobiyi,nigeria,2016,TV-14,103 min,dramas international movies romantic movies,26,2,2020
s2880,movie,gbomo gbomo express,walter taylaur,nigeria,2015,TV-MA,97 min,dramas international movies,26,2,2020
s2882,movie,taxi driver,daniel oriahi,nigeria,2015,TV-MA,94 min,comedies dramas independent movies,26,2,2020
s2883,movie,the arbitration,niyi akinmolayan,nigeria,2016,TV-MA,101 min,dramas international movies,26,2,2020
s2886,movie,when love happens,seyi babatope,nigeria,2014,TV-14,109 min,international movies romantic movies,26,2,2020
s2887,movie,pete davidson alive from new york,jason orley,united states,2020,TV-MA,50 min,stand-up comedy,25,2,2020
s2888,movie,full count,robert eagar,united states,2019,TV-PG,110 min,children & family movies dramas faith & spirituality,23,2,2020
s2890,movie,girl on the third floor,travis stevens,united states,2019,TV-MA,92 min,horror movies,22,2,2020
s2891,tv show,unabomber  in his own words,mick grogan,canada,2018,TV-MA,1 Season,crime tv shows docuseries,22,2,2020
s2896,movie,system crasher,nora fingscheidt,germany,2020,TV-MA,120 min,dramas independent movies international movies,21,2,2020
s2897,movie,the body,jeethu joseph,india,2019,TV-14,101 min,international movies thrillers,21,2,2020
s2898,movie,the last thing he wanted,dee rees,united states,2020,R,116 min,dramas thrillers,21,2,2020
s2899,movie,yeh ballet,sooni taraporevala,india,2020,TV-MA,117 min,dramas international movies,21,2,2020
s2900,movie,pretville,linda korsten,south africa,2012,TV-PG,95 min,comedies international movies music & musicals,20,2,2020
s2902,movie,untamed romania,tom barton-humphreys,romania,2018,TV-PG,93 min,children & family movies documentaries international movies,20,2,2020
s2904,movie,by the sea,angelina jolie,france,2015,R,122 min,dramas romantic movies,16,2,2020
s2905,movie,miss virginia,rj daniel hanna,united states,2019,TV-MA,102 min,dramas independent movies,16,2,2020
s2906,movie,mr right,paco cabezas,united states,2015,R,96 min,action & adventure comedies romantic movies,16,2,2020
s2907,tv show,on the real,tosin coker,nigeria,2017,TV-MA,1 Season,international tv shows tv dramas,16,2,2020
s2908,movie,term life,peter billingsley,united states,2016,R,93 min,dramas thrillers,16,2,2020
s2909,movie,the forest,jason zada,united states,2016,PG-13,93 min,horror movies independent movies,16,2,2020
s2910,movie,monster high electrified,avgousta zourelidi,unknown,2017,TV-Y,72 min,movies,15,2,2020
s2912,movie,a shaun the sheep movie farmageddon,richard phelan will becher,united kingdom,2019,G,87 min,children & family movies comedies,14,2,2020
s2913,movie,cuddle weather,rod cabatana marmol,philippines,2019,TV-MA,95 min,dramas international movies romantic movies,14,2,2020
s2914,movie,fanatyk,michał tylka,poland,2017,TV-MA,33 min,comedies dramas independent movies,14,2,2020
s2915,movie,isi & ossi,oliver kienle,germany,2020,TV-MA,113 min,comedies international movies romantic movies,14,2,2020
s2916,movie,liefling,brian webber,south africa,2010,TV-PG,118 min,comedies international movies music & musicals,14,2,2020
s2917,movie,panipat  the great betrayal,ashutosh gowariker,india,2019,TV-14,171 min,dramas international movies romantic movies,14,2,2020
s2919,movie,the ghost and the tout,charles uwagbai,nigeria,2018,TV-14,100 min,comedies international movies,14,2,2020
s2920,movie,dragon quest your story,takashi yamazaki ryuichi yagi makoto hanafusa,japan,2019,TV-PG,103 min,action & adventure anime features children & family movies,13,2,2020
s2924,tv show,sleepless society insomnia,pantham thongsang cheewatan pusitsuksa,thailand,2019,TV-MA,1 Season,crime tv shows international tv shows tv dramas,13,2,2020
s2925,movie,french toast,paul krüger anél stolp,south africa,2015,TV-PG,86 min,comedies international movies romantic movies,12,2,2020
s2926,movie,to all the boys ps i still love you,michael fimognari,united states,2020,TV-14,102 min,comedies romantic movies,12,2,2020
s2929,movie,good time,benny safdie josh safdie,united states,2017,R,101 min,dramas independent movies thrillers,11,2,2020
s2930,movie,road to roma,andres clariond,mexico,2020,TV-PG,73 min,documentaries international movies,11,2,2020
s2931,movie,love for sale 2,andibachtiar yusuf,indonesia,2019,TV-14,96 min,dramas international movies romantic movies,10,2,2020
s2933,movie,fronteras,andrew dean,united states,2018,TV-MA,106 min,dramas independent movies thrillers,9,2,2020
s2934,movie,polaroid,lars klevberg,united states,2019,PG-13,88 min,horror movies,9,2,2020
s2935,movie,the coldest game,lukasz kosmicki,poland,2019,TV-MA,103 min,dramas international movies thrillers,8,2,2020
s2936,movie,thottappan,shanavas k bavakutty,india,2019,TV-14,139 min,comedies dramas international movies,8,2,2020
s2937,movie,azali,kwabena gyansah,ghana,2018,TV-14,89 min,dramas international movies,7,2,2020
s2940,movie,horse girl,jeff baena,united states,2020,R,104 min,dramas independent movies,7,2,2020
s2941,movie,jada,kumaran,india,2019,TV-14,124 min,dramas international movies sports movies,7,2,2020
s2947,movie,gardeners of eden,austin peck anneliese vandenberg,kenya,2014,TV-14,70 min,documentaries,6,2,2020
s2948,tv show,arrow,james bamford,united states,2019,TV-14,8 Seasons,crime tv shows tv action & adventure,5,2,2020
s2949,tv show,the pharmacist,julia willoughby nason jenner furst,united states,2020,TV-MA,1 Season,crime tv shows docuseries,5,2,2020
s2950,movie,uppity the willy t ribbs story,nate adams adam carolla,united states,2020,TV-MA,106 min,documentaries sports movies,5,2,2020
s2951,movie,dragonheart vengeance,ivan silvestrini,united states,2020,PG-13,97 min,action & adventure sci-fi & fantasy,4,2,2020
s2952,movie,faith hope & love,robert krantz,united states,2019,PG,106 min,comedies faith & spirituality romantic movies,4,2,2020
s2953,movie,tom papa you're doing great!,gregory jacobs,united states,2020,TV-14,60 min,stand-up comedy,4,2,2020
s2955,movie,thambi,jeethu joseph,india,2019,TV-14,148 min,international movies thrillers,3,2,2020
s2956,movie,the silent war,alfonso cortés-cavanillas,spain,2020,TV-MA,122 min,dramas international movies thrillers,3,2,2020
s2957,movie,chronically metropolitan,xavier manrique,united states,2016,TV-MA,86 min,comedies dramas independent movies,1,2,2020
s2961,movie,justice,richard gabai,united states,2017,R,92 min,movies,1,2,2020
s2962,movie,love jacked,alfons adetuyi,canada,2018,PG-13,94 min,comedies international movies romantic movies,1,2,2020
s2963,tv show,miraculous tales of ladybug & cat noir,thomas astruc,france,2019,TV-Y7,5 Seasons,kids tv tv action & adventure,1,2,2020
s2964,movie,misfit 2,erwin van den eshof,netherlands,2019,TV-G,82 min,children & family movies comedies international movies,1,2,2020
s2969,movie,the car road to revenge,gj echternkamp,united states,2019,TV-MA,89 min,action & adventure horror movies sci-fi & fantasy,1,2,2020
s2971,movie,37 seconds,hikari,japan,2020,TV-MA,116 min,dramas international movies,31,1,2020
s2973,movie,gang of the caribbean,jean-claude flamand-barny,france,2016,TV-MA,86 min,dramas international movies,31,1,2020
s2974,movie,hakkunde,oluseyi asurf,nigeria,2017,TV-14,93 min,comedies dramas independent movies,31,1,2020
s2976,movie,miss americana,lana wilson,united states,2020,TV-MA,85 min,documentaries music & musicals,31,1,2020
s2979,movie,kevin hart i'm a grown little man,shannon hartman,united states,2009,TV-MA,62 min,stand-up comedy,30,1,2020
s2982,movie,close enemies,david oelhoffen,france,2018,TV-MA,112 min,dramas international movies,29,1,2020
s2986,movie,shimla mirchi,ramesh sippy,india,2020,TV-14,121 min,comedies international movies romantic movies,27,1,2020
s2987,movie,sillu karuppatti,halitha shameem,india,2019,TV-14,133 min,comedies dramas independent movies,26,1,2020
s2988,movie,vir das for india,vir das ajay bhuyan,india,2020,TV-MA,76 min,stand-up comedy,26,1,2020
s2989,movie,menashe,josh z weinstein joshua z weinstein,united states,2017,PG,82 min,dramas independent movies,25,1,2020
s2990,movie,a sun,chung mong-hong,taiwan,2019,TV-MA,156 min,dramas independent movies international movies,24,1,2020
s2991,movie,die ontwaking,johnny breedt,south africa,2015,TV-MA,90 min,international movies thrillers,24,1,2020
s2996,movie,airplane mode,césar rodrigues,united states,2020,TV-PG,97 min,comedies international movies romantic movies,23,1,2020
s2997,movie,alex fernández the best comedian in the world,alex díaz,mexico,2020,TV-MA,51 min,stand-up comedy,23,1,2020
s3000,tv show,the ghost bride,quek shio-chuan,taiwan,2020,TV-14,1 Season,international tv shows tv dramas tv mysteries,23,1,2020
s3004,movie,fortune feimster sweet & salty,krysia plonka,united states,2020,TV-MA,61 min,stand-up comedy,21,1,2020
s3005,movie,kd (a) karuppudurai,madhumita,india,2019,TV-14,116 min,comedies dramas independent movies,21,1,2020
s3007,movie,motichoor chaknachoor,debamitra biswal,india,2019,TV-14,132 min,comedies dramas international movies,20,1,2020
s3008,movie,what did jack do?,david lynch,united states,2020,TV-14,17 min,dramas independent movies,20,1,2020
s3009,movie,the bling ring,sofia coppola,united states,2013,R,91 min,dramas independent movies,18,1,2020
s3010,movie,a fall from grace,tyler perry,united states,2020,TV-MA,121 min,dramas thrillers,17,1,2020
s3015,movie,deadcon,caryn waechter,united states,2019,TV-14,78 min,horror movies,16,1,2020
s3017,movie,hop,tim hill,united states,2011,PG,95 min,children & family movies comedies,16,1,2020
s3018,movie,jezebel,numa perrier,united states,2019,TV-MA,86 min,dramas independent movies,16,1,2020
s3019,movie,legend,brian helgeland,united kingdom,2015,R,132 min,dramas international movies thrillers,16,1,2020
s3020,movie,ninokuni,yoshiyuki momose,japan,2019,TV-14,107 min,action & adventure anime features children & family movies,16,1,2020
s3022,movie,steve jobs,danny boyle,united kingdom,2015,R,122 min,dramas,16,1,2020
s3023,movie,bulbul can sing,rima das,india,2018,TV-14,95 min,dramas independent movies international movies,15,1,2020
s3024,movie,eye for an eye,paco plaza,spain,2019,TV-MA,108 min,dramas international movies thrillers,15,1,2020
s3026,movie,mindgamers,andrew goth,austria,2017,R,99 min,international movies sci-fi & fantasy thrillers,15,1,2020
s3027,movie,the brave,william kaufman,united states,2019,TV-MA,103 min,action & adventure independent movies,15,1,2020
s3028,movie,leslie jones time machine,david benioff db weiss,united states,2020,TV-MA,66 min,stand-up comedy,14,1,2020
s3030,movie,women of mafia 2,patryk vega,poland,2019,TV-MA,132 min,action & adventure dramas international movies,14,1,2020
s3032,movie,betty white first lady of television,steve boettcher,united states,2018,TV-14,56 min,documentaries,12,1,2020
s3033,movie,made in china,mikhil musale,india,2019,TV-MA,128 min,comedies dramas international movies,12,1,2020
s3037,tv show,jamtara  sabka number ayega,soumendra padhi,india,2020,TV-MA,1 Season,crime tv shows international tv shows tv dramas,10,1,2020
s3039,movie,monsters dark continent,tom green,united kingdom,2014,R,119 min,action & adventure dramas independent movies,10,1,2020
s3042,movie,bulletproof 2,don michael paul,united states,2020,TV-MA,97 min,action & adventure comedies,9,1,2020
s3044,movie,a ghost story,david lowery,united states,2017,R,92 min,dramas independent movies,7,1,2020
s3045,movie,live twice love once,maria ripoll,spain,2020,TV-MA,102 min,comedies dramas international movies,7,1,2020
s3047,movie,all the freckles in the world,yibrán asuad,mexico,2020,TV-14,90 min,comedies international movies romantic movies,3,1,2020
s3049,movie,half girlfriend,mohit suri,india,2017,TV-14,129 min,dramas international movies romantic movies,2,1,2020
s3052,movie,aruna & her palate,edwin,indonesia,2018,TV-14,106 min,dramas international movies,1,1,2020
s3055,movie,breaking the bank,vadim jean,united kingdom,2014,TV-PG,105 min,comedies international movies,1,1,2020
s3058,movie,garfield gets real,mark az dippé kyung ho lee,united states,2007,TV-Y,78 min,children & family movies comedies,1,1,2020
s3059,movie,garfield's fun fest,mark az dippé eondeok han,united states,2008,TV-Y7,79 min,children & family movies comedies,1,1,2020
s3060,movie,garfield's pet force,mark az dippé,south korea,2009,G,78 min,children & family movies comedies,1,1,2020
s3061,movie,ghost stories,anurag kashyap dibakar banerjee karan johar zoya akhtar,india,2020,TV-MA,145 min,horror movies international movies thrillers,1,1,2020
s3062,movie,jeff dunham unhinged in hollywood,michael simon,united states,2015,TV-MA,71 min,stand-up comedy,1,1,2020
s3065,movie,luccas neto in children's day,lucas margutti,brazil,2019,TV-G,81 min,children & family movies comedies music & musicals,1,1,2020
s3073,movie,riot,john lyde,unknown,2015,TV-MA,88 min,action & adventure,1,1,2020
s3068,tv show,nisman the prosecutor the president and the spy,justin webster,spain,2020,TV-MA,1 Season,crime tv shows docuseries international tv shows,1,1,2020
s3069,movie,pan's labyrinth,guillermo del toro,mexico,2006,R,119 min,dramas international movies sci-fi & fantasy,1,1,2020
s3070,movie,pokémon the movie power of us,tetsuo yajima,japan,2018,TV-Y7,98 min,anime features children & family movies,1,1,2020
s3071,movie,posesif,edwin,indonesia,2017,TV-MA,102 min,dramas international movies romantic movies,1,1,2020
s3074,movie,road trip beer pong,steve rash,united states,2009,R,97 min,comedies,1,1,2020
s3078,movie,aaviri,ravi babu,india,2019,TV-14,110 min,horror movies international movies thrillers,31,12,2019
s3079,movie,albert pinto ko gussa kyun aata hai?,soumitra ranade,india,2019,TV-MA,85 min,dramas independent movies international movies,31,12,2019
s3081,movie,benchwarmers 2 breaking balls,jon rosenbaum,united states,2019,PG-13,90 min,comedies sports movies,31,12,2019
s3082,movie,how high 2,bruce leddy,united states,2019,TV-MA,89 min,comedies,31,12,2019
